{
  "schema_version": "1.0",
  "fixture": {
    "id": "fixture_build_week_approval_v1",
    "title": "Approval-bound deployment run",
    "classification": "synthetic_demo",
    "created_at": "2026-07-18T14:30:00.000Z",
    "description": "A deterministic agent run paused before a write-capable tool effect."
  },
  "run": {
    "id": "run_01JY7KYN9X4N",
    "correlation_id": "corr_01JY7KYN7M2Q",
    "status": "blocked",
    "revision": 7,
    "started_at": "2026-07-18T14:32:11.122Z",
    "updated_at": "2026-07-18T14:32:18.904Z",
    "duration_ms": 7782,
    "definition": {
      "slug": "release:guarded-deploy",
      "version": "1.4.0",
      "fingerprint": "sha256:4e2a7c9d6f31"
    },
    "agent": {
      "name": "release-sentinel",
      "runtime": "acp:turn",
      "model": "gpt-5.6",
      "permission_mode": "manual"
    },
    "goal": "Deploy the verified checkout service candidate to the synthetic staging target.",
    "diagnosis": {
      "eyebrow": "Causal diagnosis",
      "title": "The run is healthy. It is waiting for one human decision.",
      "summary": "A write-capable tool call reached its declared approval boundary. The queue lease is healthy and the worker is still fenced, so retrying infrastructure would create risk instead of progress.",
      "cause_node_id": "approval",
      "confidence": "deterministic",
      "next_action": "Review and authorize the simulated deployment command."
    },
    "impact": {
      "scope": "synthetic staging",
      "risk": "write-capable",
      "external_effect": false
    }
  },
  "nodes": [
    {
      "id": "accepted",
      "order": 1,
      "lane": "main",
      "kind": "trigger",
      "title": "Run accepted",
      "subtitle": "Definition pinned",
      "source": "appiyon.flow_run",
      "status": "completed",
      "observed_at": "2026-07-18T14:32:11.122Z",
      "evidence": "The run was created with an immutable definition fingerprint.",
      "fields": {
        "run_id": "run_01JY7KYN9X4N",
        "definition": "release:guarded-deploy@1.4.0",
        "revision": 7
      }
    },
    {
      "id": "plan",
      "order": 2,
      "lane": "main",
      "kind": "agent_step",
      "title": "Plan verified",
      "subtitle": "3 read checks passed",
      "source": "kynllm.agent_step",
      "status": "completed",
      "observed_at": "2026-07-18T14:32:16.410Z",
      "evidence": "The agent read the release manifest, test receipt, and target policy before requesting a write.",
      "fields": {
        "step": 4,
        "reads": 3,
        "policy": "deploy-staging-v2",
        "reasoning_visibility": "summary-only"
      }
    },
    {
      "id": "tool",
      "order": 3,
      "lane": "main",
      "kind": "tool_call",
      "title": "Deploy requested",
      "subtitle": "Write held before effect",
      "source": "kynllm.tool_call",
      "status": "waiting",
      "observed_at": "2026-07-18T14:32:17.008Z",
      "evidence": "The tool broker classified deploy.release as write-capable and withheld execution.",
      "fields": {
        "tool": "deploy.release",
        "target": "staging-eu-1",
        "artifact": "checkout@9f31c2a",
        "permission": "write",
        "connector_credential": "SYNTHETIC_VALUE"
      }
    },
    {
      "id": "approval",
      "order": 4,
      "lane": "main",
      "kind": "approval_gate",
      "title": "Approval required",
      "subtitle": "Operator decision missing",
      "source": "kynllm.approval_gate",
      "status": "blocked",
      "observed_at": "2026-07-18T14:32:17.031Z",
      "evidence": "Policy requires a named operator and reason before this write can cross the effect boundary.",
      "fields": {
        "approval_id": "approval_01JY7M4D",
        "policy": "human-before-write",
        "decision": "pending",
        "allowed_command": "approve_tool_call"
      }
    },
    {
      "id": "effect",
      "order": 5,
      "lane": "main",
      "kind": "effect",
      "title": "Deployment effect",
      "subtitle": "Not executed",
      "source": "connector.invoke",
      "status": "pending",
      "observed_at": null,
      "evidence": "No external effect exists. The Build Week demo will simulate this transition locally.",
      "fields": {
        "effect_boundary": "external_write",
        "executed": false,
        "demo_only": true
      }
    },
    {
      "id": "terminal",
      "order": 6,
      "lane": "main",
      "kind": "terminal",
      "title": "Run terminal",
      "subtitle": "Waiting upstream",
      "source": "appiyon.flow_run",
      "status": "pending",
      "observed_at": null,
      "evidence": "The terminal is unreachable until the approval and effect transitions are acknowledged.",
      "fields": {
        "expected": "completed",
        "current": "blocked"
      }
    },
    {
      "id": "queue",
      "order": 1,
      "lane": "guardrail",
      "kind": "queue_lease",
      "title": "Queue lease healthy",
      "subtitle": "42 s remaining",
      "source": "queue_engine.lease",
      "status": "healthy",
      "observed_at": "2026-07-18T14:32:18.904Z",
      "evidence": "The current claimant owns a live fenced lease. Infrastructure retry is not the remedy.",
      "fields": {
        "queue": "flow:default",
        "partition": "run_01JY7KYN9X4N",
        "owner": "worker-demo-3",
        "claim_token": "REDACTED_BY_FIXTURE",
        "lease_remaining_seconds": 42
      }
    }
  ],
  "edges": [
    { "id": "edge_1", "from": "accepted", "to": "plan", "relation": "advances", "status": "traversed" },
    { "id": "edge_2", "from": "plan", "to": "tool", "relation": "requests", "status": "traversed" },
    { "id": "edge_3", "from": "tool", "to": "approval", "relation": "requires", "status": "blocked" },
    { "id": "edge_4", "from": "approval", "to": "effect", "relation": "authorizes", "status": "pending" },
    { "id": "edge_5", "from": "effect", "to": "terminal", "relation": "completes", "status": "pending" },
    { "id": "edge_6", "from": "tool", "to": "queue", "relation": "suspended_as", "status": "traversed" },
    { "id": "edge_7", "from": "queue", "to": "approval", "relation": "awaits", "status": "healthy" }
  ],
  "events": [
    {
      "id": "event_001",
      "sequence": 1,
      "occurred_at": "2026-07-18T14:32:11.122Z",
      "source": "appiyon.flow_run",
      "type": "run.accepted",
      "status": "completed",
      "summary": "Pinned release:guarded-deploy@1.4.0",
      "correlation_id": "corr_01JY7KYN7M2Q",
      "detail": { "revision": 7 }
    },
    {
      "id": "event_002",
      "sequence": 2,
      "occurred_at": "2026-07-18T14:32:16.410Z",
      "source": "kynllm.agent_step",
      "type": "agent.step.completed",
      "status": "completed",
      "summary": "Release evidence read and policy selected",
      "correlation_id": "corr_01JY7KYN7M2Q",
      "detail": { "step": 4, "reads": 3 }
    },
    {
      "id": "event_003",
      "sequence": 3,
      "occurred_at": "2026-07-18T14:32:17.008Z",
      "source": "kynllm.tool_call",
      "type": "tool.call.requested",
      "status": "waiting",
      "summary": "deploy.release requested for staging-eu-1",
      "correlation_id": "corr_01JY7KYN7M2Q",
      "detail": { "permission": "write", "effected": false }
    },
    {
      "id": "event_004",
      "sequence": 4,
      "occurred_at": "2026-07-18T14:32:17.031Z",
      "source": "kynllm.approval_gate",
      "type": "approval.waiting",
      "status": "blocked",
      "summary": "Named operator approval required",
      "correlation_id": "corr_01JY7KYN7M2Q",
      "detail": { "approval_id": "approval_01JY7M4D" }
    },
    {
      "id": "event_005",
      "sequence": 5,
      "occurred_at": "2026-07-18T14:32:18.904Z",
      "source": "queue_engine.lease",
      "type": "queue.lease.heartbeat",
      "status": "healthy",
      "summary": "Claim fenced; 42 seconds remain",
      "correlation_id": "corr_01JY7KYN7M2Q",
      "detail": { "queue": "flow:default", "lease_remaining_seconds": 42 }
    }
  ],
  "intervention": {
    "command_id": "cmd_01JY7M8ZQJ2K",
    "idempotency_key": "run_01JY7KYN9X4N:approval_01JY7M4D:approve",
    "type": "approve_tool_call",
    "label": "Authorize simulated deployment",
    "description": "Resolve the held approval, simulate the declared effect, and replay the run to its terminal.",
    "expected_revision": 7,
    "allowed_from": "blocked",
    "actor": "build-week-judge",
    "scope": "synthetic staging only",
    "preview": [
      { "label": "Approval", "value": "approval_01JY7M4D" },
      { "label": "Tool", "value": "deploy.release" },
      { "label": "Target", "value": "staging-eu-1" },
      { "label": "External effect", "value": "None — local simulation" },
      { "label": "Revision fence", "value": "Must equal 7" }
    ],
    "resolution": {
      "new_revision": 8,
      "completed_at": "2026-07-18T14:32:21.204Z",
      "diagnosis": {
        "eyebrow": "Resolved causality",
        "title": "The intervention was acknowledged and the run completed.",
        "summary": "The approval was resolved against revision 7, the synthetic effect was recorded, and the original evidence remains available in the append-only replay.",
        "cause_node_id": "terminal",
        "confidence": "deterministic",
        "next_action": "Inspect the receipt or reset the demo."
      },
      "node_updates": {
        "tool": { "status": "completed", "subtitle": "Request authorized", "observed_at": "2026-07-18T14:32:20.742Z" },
        "approval": { "status": "completed", "subtitle": "Approved by build-week-judge", "observed_at": "2026-07-18T14:32:20.731Z" },
        "effect": { "status": "completed", "subtitle": "Simulated locally", "observed_at": "2026-07-18T14:32:20.986Z" },
        "terminal": { "status": "completed", "subtitle": "Run completed", "observed_at": "2026-07-18T14:32:21.204Z" }
      },
      "edge_updates": {
        "edge_3": "traversed",
        "edge_4": "traversed",